id;isbn;title;small_image_url;medium_image_url;language;price;nb_of_pages;publication;category_id;publisher_id;description
1067;1782178120;Developing RESTful Services with JAX-RS 2.0, WebSockets, and JSON;http://ecx.images-amazon.com/images/I/518dkRyrmyL._SL160_.jpg;http://ecx.images-amazon.com/images/I/518dkRyrmyL._SL160_.jpg;SPANISH;39.99;128;now();1001;1003;Improving your productivity by making the most of Java EE 7s capabilities is made easy and practical with this book. Its the perfect guide to developing RESTful Services utilizing powerful new technologies. OverviewLearning about different client/server communication models including but not limited to client pollingServer-Sent Events and WebSockets. Efficiently use WebSocketsServer-Sent Eventsand JSON in Java EE applicationsLearn about JAX-RS 2.0 new features and enhancementsImprove scalability with asynchronous processingIn DetailAs the technology landscape moves focus towards smaller devicesthe need for building scalableflexiblelightweightand real-time communications-based applications grows. HTML 5 and Java EE 7 provide a new synthesis of technologies that demonstrate tremendous scope and potential in areas of device independenceasynchronous communicationinteroperabilityand portability. Developing RESTful Services with JAX-RS 2.0WebSocketsand JSON is a practicalhands-on guide that provides you with clear and pragmatic information to take advantage of the real power behind HTML5 and Java EE technologies. This book also gives you a good foundation for using them in your applications. Developing RESTful Services with JAX-RS 2.0WebSocketsand JSON looks at the different HTML5-based Java EE 7 APIand takes a deep dive into the individual areas of technologies to cover basic to advanced conceptsand also provides best practices for each API. You will also learn how to build a REST-based Event Notification Application using the Twitter APItying all the different technologies together that we will cover. You will also take a look at integrating different Java EE APIs to build a Library Application. If you want to take advantage of using the new HTML5 technologies and Java EE 7 platformthen this is the book for you. You will learn everything you need to know to build portable RESTful Web Services with JAX-RS 2.0Web SocketsJSONand Server-Sent Events. What you will learn from this bookDevelop RESTful Web Services using the JAX-RS 2.0 APIBuild applications with the JavaScript and Java Client API for WebSockets and ServerSentEvents Understand Security and Fault tolerance with WebSockets and ServerSentEventsProduceparseand manipulate JSON data with the help of JSON-P APICover best practices in building applications with WebSocketsServerSentEventsand JAX-RS 2.0 Learn the aspects of asynchronous programming to improve scalabilityApproachWritten as an easy and practical guidethis book is a crash course on using JAX-RS 2.0JSONand WebSockets to develop RESTful services. Who this book is written forDeveloping RESTful Services with JAX-RS 2.0WebSocketsand JSON is a perfect reading source for application developers who are familiar with Java EE and are keen to understand the new HTML5-related functionality introduced in Java EE 7 to improve productivity. To take full advantage of this bookyou need to be familiar with Java EE and have some basic understanding of using the GlassFish application server
1068;1783288299;Developing RESTful Web Services with Jersey 2.0;http://ecx.images-amazon.com/images/I/51xmOMQtc7L._SL160_.jpg;http://ecx.images-amazon.com/images/I/51xmOMQtc7L._SL160_.jpg;ENGLISH;34.99;98;now();1005;1005;Learn how to design and implement a test automation framework block by blockOverviewA simple and easy demonstration of the important concepts will enable you to translate abstract ideas into practice Each chapter begins with an outline and a brief statement of content to help the reader establish perspective An alternative approach to developing generic components for test automationIn DetailAs software testing is maturingthe focus is shifting towards test automation. The key is to learn and grow skills in framework designing and start contributing to project organization goals. Through a helpful mix of conceptual and practical aspectsyou will learn everything you need to know related to the implementation of frameworks using QTP. Through simple examplesyou will gradually develop the skills needed to execute concepts and code blocks used to design and implement the test automation framework. This tutorial-based guide demonstrates an easy way to implement concepts to create a portable framework across the various versions of QTP. You will learn about the automation lifecycle and gradually develop technical concepts related to each phase. Within a short amount of timeyou will be able to deal with challenges in test automation. Designing and Implementing Test Automation Frameworks with QTP uses a simpleyet elegant approach and gives the reader all the skills and knowledge they need to implement the framework. What you will learn from this bookUnderstand the test automation lifecycleas well as the goals that drive and guide its framework design Grasp the basic features of QTP that help in creating frameworksLearn about the various goals of each level of framework and how they drive the designing of the framework Create basic building block supportsUnderstand the types of framework and how to design and use themUse Javascript and HTMLDOM effectivelyCapture lessons learnt in framework designing and share those experiencesDeploy and maintain frameworksBuild an XPath expressionlocate the elements and perform an action on itApproachA tutorial-based approachshowing basic coding and designing techniques to build test automation frameworks. Who this book is written forIf you are a beginneran automation engineeran aspiring test automation engineera manual testera test lead or a test architect who wants to learncreateand maintain test automation frameworksthis book will accelerate your ability to develop and adapt the framework
1069;3319054392;ECUMICT 2014: Proceedings of the European Conference on the Use of Modern Information and Communication Technologies, Gent, March 2014 (Lecture Notes in Electrical Engineering);http://ecx.images-amazon.com/images/I/418YoIyKXKL._SL160_.jpg;http://ecx.images-amazon.com/images/I/418YoIyKXKL._SL160_.jpg;FRENCH;199.00;231;now();1012;1001;This proceeding present the outcome of the 6th. European Conference on the Use of Modern Information and Communication Technologies. The ECUMICT 2014 was hold in Gent in March 2014 and presented recent researchthat has a close relationship with practical implementation of Security for mobile communications and data accessInterface technology for mobile devices Application development for mobile devicesPositioning and localizationasset tracking and tracing Design and applications of RFID systemsDevelopments in the framework of IoT and M2M communicationsDesign and applications of WSNsEmbedded programming for WSNsNew developments and applications of WPAN/WLAN standardsMobile multimedia systemsWireless telecommunication networks and mobile servicesOptimization techniques in wireless networksDevelopments in ad-hoc and mesh networksApplications of digital signal processing for mobile applications Applications of MEMs in WSNs
1070;1847195601;EJB 3 Developer Guide: A Practical Guide for developers and architects to the Enterprise Java Beans Standard.;http://ecx.images-amazon.com/images/I/41WV60YTuwL._SL160_.jpg;http://ecx.images-amazon.com/images/I/41WV60YTuwL._SL160_.jpg;ENGLISH;39.99;276;now();1002;1005;In DetailThe EJB 3 (Enterprise Java Beans version 3) specification is a core component of enterprise-level JEE (Java Platform Enterprise Edition) implementations and this improved version is set to simplify the development of Enterprise Java applications. This book covers the core elements of EJB 3 technologyexploring them in a concise manner with many supporting examples. You will gain a thorough understanding of EJB 3 technology and learn about the most important features of EJB 3 quickly. What you will learn from this book? This book will teach you the core elements of EJB 3 technology. You will: Gain a rapid introduction to the EJB 3 essentials while learning about the underlying principles Create EntitiesMessage-Driven BeansSession Beans and their clientsLook at running an EJB client from an application client containerLearn how to package and deploy an EJBUse JQPL (Java Persistence Query Language)Explore the entity manager interfaceLearn about object/relational mapping with EJB 3Look at the Java Messaging API and message-driven beansLook at transactionsinterceptorsand EJB timer servicesUnderstand how EJB 3 differs from the 2.x versionImplement EJB 3s security featuresApproachThis book is a fast-paced tutorial that explores the key features of EJB 3 with many accompanying examples. This book is not a complete reference guidebut a concise exploration of EJB 3s core elements. Who this book is written for?This book is primarily aimed at professional developers who already have a working knowledge of Java. Enterprise architects and designers with a background in Java would also find this book of use. Previous experience of working with Java is essential and knowledge of relational databases is desirable. As this book is an introduction to EJB 3it is aimed at those who are new to EJB 3. As the new version of EJB is so radically different from the previous version (EJB 2.x)the book is suitable for and should be of interest to those who have had experience working with EJB 2.x. The text makes it clear where the differences between the versions of EJB liealthough they are not explored in detail
1071;1935182994;EJB 3 in Action 9;http://ecx.images-amazon.com/images/I/41DEOsLnX3L._SL160_.jpg;http://ecx.images-amazon.com/images/I/41DEOsLnX3L._SL160_.jpg;DEUTSCH;54.99;560;now();1002;1000;SummaryBuilding on the bestselling first editionEJB 3 in ActionSecond Edition tackles EJB 3.2 head-onthrough numerous code samplesreal-life scenariosand illustrations. This book is a fast-paced tutorial for Java EE 6 business component development using EJB 3.2JPA 2and CDI. Besides covering the basics of EJB 3.2this book includes in-depth EJB 3.2 internal implementation detailsbest practicesdesign patternsand performance tuning tips. Purchase of the print book includes a free eBook in PDFKindleand ePub formats from Manning Publications. About the BookThe EJB 3 framework provides a standard way to capture business logic in manageable server-side modulesmaking it easier to writemaintainand extend Java EE applications. EJB 3.2 provides more enhancements and intelligent defaults and integrates more fully with other Java technologiessuch as CDIto make development even easier. EJB 3 in ActionSecond Edition is a fast-paced tutorial for Java EE business component developers using EJB 3.2JPAand CDI. It tackles EJB head-on through numerous code samplesreal-life scenariosand illustrations. Beyond the basicsthis book includes internal implementation detailsbest practicesdesign patternsperformance tuning tipsand various means of access including Web ServicesREST Servicesand WebSockets. Readers need to know Java. No prior experience with EJB or Java EE is assumed.Whats InsideFully revised for EJB 3.2POJO persistence with JPA 2.1Dependency injection and bean management with CDI 1.1Interactive application with WebSocket 1.0About the AuthorsDebu PandaReza RahmanRyan Cuprakand Michael Remijan are seasoned Java architectsdevelopersauthorsand community leaders. Debu and Reza coauthored the first edition ofEJB 3 in Action. Table of ContentsPART 1 OVERVIEW OF THE EJB LANDSCAPEWhats what in EJB 3A first taste of EJBPART 2 WORKING WITH EJB COMPONENTSBuilding business logic with session beansMessaging and developing MDBsEJB runtime contextdependency injectionand crosscutting logicTransactions and securityScheduling and timersExposing EJBs as web servicesPART 3 USING EJB WITH JPA AND CDIJPA entitiesManaging entitiesJPQLUsing CDI with EJB 3PART 4 PUTTING EJB INTO ACTIONPackaging EJB 3 applicationsUsing WebSockets with EJB 3Testing and EJB
1072;1933988347;EJB 3 in Action 9;http://ecx.images-amazon.com/images/I/415c-uC8TXL._SL160_.jpg;http://ecx.images-amazon.com/images/I/415c-uC8TXL._SL160_.jpg;FRENCH;44.99;712;now();1009;1007;EJB 3 in Action tackles EJB 3 and the Java Persistence API head-onproviding practical code samplesreal-life scenariosbest practicesdesign patternsand performance tuning tips. This book builds on the contributions and strengths of seminal technologies like SpringHibernateand TopLink. EJB 3 is the most important innovation introduced in Java EE 5.0. EJB 3 simplifies enterprise developmentabandoning the complex EJB 2.x model in favor of a lightweight POJO framework. The new API represents a fresh perspective on EJB without sacrificing the mission of enabling business application developers to create robustscalablestandards-based solutions. EJB 3 in Action is a fast-paced tutorialgeared toward helping you learn EJB 3 and the Java Persistence API quickly and easily. For newcomers to EJBthis book provides a solid foundation in EJB. For the developer moving to EJB 3 from EJB 2this book addresses the changes both in the EJB API and in the way the developer should approach EJB and persistence. Purchase of the print book comes with an offer of a free PDFePuband Kindle eBook from Manning. Also available is all code from the book
1073;1783285451;Enterprise Application Development with Ext JS and Spring;http://ecx.images-amazon.com/images/I/51wFwTy1PPL._SL160_.jpg;http://ecx.images-amazon.com/images/I/51wFwTy1PPL._SL160_.jpg;ENGLISH;49.99;446;now();1012;1008;Designed for intermediate developersthis superb tutorial will lead you step by step through the process of developing enterprise web applications combining two leading-edge frameworks. Take a big leap forward in easy stages. OverviewEmbark on the exciting journey through the entire enterprise web application development lifecycle Leverage key Spring Framework concepts to deliver comprehensive and concise Java codeBuild a real world ExtJS web application that interacts with dynamic database driven data In DetailSpring and ExtJS are cutting edge frameworks that allow us to build high performance web applications for modern devicesthat are now consuming data at a faster rate than ever before. It is the appropriate time for you to understand how to best leverage these technologies when architectingdesigningand developing large scale web development projects. This practical guide condenses an approach to web development that was gained from real world projectsand outlines a simplepractical approach to developing high performanceand enterprise grade web applications. Starting with configuring JavaNetbeansand MySQL to prepare your development environmentyou will then learn how to connect your Netbeans IDE to the MySQL database server. We will then explore the Task Time Tracker (3T) project database structure and populate these tables with test data. Following on from thiswe will examine core JPA concepts after reverse engineering the domain layer with Netbeans. Leveraging the Data Access Object design patternyou will learn how to build the Java DAO implementation layer assisted by generics in base classesfollowed by a Data Transfer Object enabled service layer to encapsulate the business logic of your 3T application. The final chapters that focus on Java explore how to implement the request handling layer using Spring annotated controllersand deploy the 3T application to the Glassfish server. We will then configure the ExtJS 4 development environment and introduce key ExtJS 4 conceptsincluding MVC and practical design conventions. Covering a variety of important ExtJS 4 strategies and conceptsyou will be fully-equipped to implement a variety of different user interfaces using the ExtJS MVC design pattern. Your journey ends by exploring the production build and deployment process using MavenSencha Cmd and Glassfish. What you will learn from this bookSet up the key components of an enterprise development environmentGet to grips with practical database design strategies using MySQLPractice JPA concepts and database reverse engineering using NetbeansAccess data using the DAO design pattern and SpringImplement practical testing strategies using Maven and JUnitBuild a comprehensive service layer to encapsulate business logicLeverage the best of Spring Web controllers for enterprise useImplement a dynamic ExtJS user interface using Sencha MVCUnderstand and control the Maven build processConfigure and deploy to a production Glassfish environmentApproachAn easy-to-follow tutorialthat breaks down the enterprise application development journey into easy to understand phases documented by clear examples and concise explanations
1074;3826616995;Enterprise JavaBeans 3.0 mit Eclipse und JBoss: Praxisbuch und Referenz;http://ecx.images-amazon.com/images/I/51AeBG-ywEL._SL160_.jpg;http://ecx.images-amazon.com/images/I/51AeBG-ywEL._SL160_.jpg;PORTUGUESE;149.00;347;now();1012;1008;Designed for intermediate developersthis superb tutorial will lead you step by step through the process of developing enterprise web applications combining two leading-edge frameworks. Take a big leap forward in easy stages. OverviewEmbark on the exciting journey through the entire enterprise web application development lifecycle Leverage key Spring Framework concepts to deliver comprehensive and concise Java codeBuild a real world ExtJS web application that interacts with dynamic database driven data In DetailSpring and ExtJS are cutting edge frameworks that allow us to build high performance web applications for modern devicesthat are now consuming data at a faster rate than ever before. It is the appropriate time for you to understand how to best leverage these technologies when architectingdesigningand developing large scale web development projects. This practical guide condenses an approach to web development that was gained from real world projectsand outlines a simplepractical approach to developing high performanceand enterprise grade web applications. Starting with configuring JavaNetbeansand MySQL to prepare your development environmentyou will then learn how to connect your Netbeans IDE to the MySQL database server. We will then explore the Task Time Tracker (3T) project database structure and populate these tables with test data. Following on from thiswe will examine core JPA concepts after reverse engineering the domain layer with Netbeans. Leveraging the Data Access Object design patternyou will learn how to build the Java DAO implementation layer assisted by generics in base classesfollowed by a Data Transfer Object enabled service layer to encapsulate the business logic of your 3T application. The final chapters that focus on Java explore how to implement the request handling layer using Spring annotated controllersand deploy the 3T application to the Glassfish server. We will then configure the ExtJS 4 development environment and introduce key ExtJS 4 conceptsincluding MVC and practical design conventions. Covering a variety of important ExtJS 4 strategies and conceptsyou will be fully-equipped to implement a variety of different user interfaces using the ExtJS MVC design pattern. Your journey ends by exploring the production build and deployment process using MavenSencha Cmd and Glassfish. What you will learn from this bookSet up the key components of an enterprise development environmentGet to grips with practical database design strategies using MySQLPractice JPA concepts and database reverse engineering using NetbeansAccess data using the DAO design pattern and SpringImplement practical testing strategies using Maven and JUnitBuild a comprehensive service layer to encapsulate business logicLeverage the best of Spring Web controllers for enterprise useImplement a dynamic ExtJS user interface using Sencha MVCUnderstand and control the Maven build processConfigure and deploy to a production Glassfish environmentApproachAn easy-to-follow tutorialthat breaks down the enterprise application development journey into easy to understand phases documented by clear examples and concise explanations1004Lorem ipsum dolor sit ametconsectetuer adipiscing elit. Aenean commodo ligula eget dolor. Aenean massa. Cum sociis natoque penatibus et magnis dis parturient montesnascetur ridiculus mus. Donec quam felisultricies necpellentesque eupretium quissem. Nulla consequat massa quis enim. Donec pede justofringilla velaliquet necvulputate egetarcu. In enim justorhoncus utimperdiet avenenatis vitaejusto. Nullam dictum felis eu pede mollis pretium. Integer tincidunt. Cras dapibus. Vivamus elementum semper nisi. Aenean vulputate eleifend tellus. Aenean leo ligulaporttitor euconsequat vitaeeleifend acenim. Aliquam lorem antedapibus inviverra quisfeugiat atellus. Phasellus viverra nulla ut metus varius laoreet. Quisque rutrum. Aenean imperdiet. Etiam ultricies nisi vel augue. Curabitur ullamcorper ultricies nisi. Nam eget dui. Etiam rhoncus. Maecenas tempustellus eget condimentum rhoncussem quam semper liberosit amet adipiscing sem neque sed ipsum. Nam quam nuncblandit velluctus pulvinarhendrerit idlorem. Maecenas nec odio et ante tincidunt tempus. Donec vitae sapien ut libero venenatis faucibus. Nullam quis ante. Etiam sit amet orci eget eros faucibus tincidunt. Duis leo. Sed fringilla mauris sit amet nibh. Donec sodales sagittis magna. Sed consequatleo eget bibendum sodalesaugue velit cursus nunc
1075;4705654544;Enterprise Software Architecture and Design: Entities, Services, and Resources;http://ecx.images-amazon.com/images/I/51FH4HeKCUL._SL160_.jpg;http://ecx.images-amazon.com/images/I/51FH4HeKCUL._SL160_.jpg;PORTUGUESE;133.00;512;now();1008;1007;This book fills a gap between high-level overview texts that are often too general and low-level detail oriented technical handbooks that lose sight the big picture. This book discusses SOA from the low-level perspective of middlewarevarious XML-based technologiesand basic service design. It also examines broader implications of SOAparticularly where it intersects with business process management and process modeling. Concrete overviews will be provided of the methodologies in those fieldsso that students will have a hands-on grasp of how they may be used in the context of SOA
1076;1449356818;Enterprise Web Development: Building HTML5 Applications: From Desktop to Mobile;http://ecx.images-amazon.com/images/I/51Twl1%2ByfQL._SL160_.jpg;http://ecx.images-amazon.com/images/I/51Twl1%2ByfQL._SL160_.jpg;PORTUGUESE;49.99;642;now();1006;1003;If you want to build your organization’s next web application with HTML5this practical book will help you sort through the various frameworkslibrariesand development options that populate this stack. You’ll learn several of these approaches hands-on by writing multiple versions of a sample web app throughout the bookso you can determine the right strategy for your enterprise. What’s the best way to reach both mobile and desktop users? How about modularizationsecurityand test-driven development? With lots of working code samplesthis book will help web application developers and software architects navigate the growing number of HTML5 and JavaScript choices available. The book’s sample apps are available at http://savesickchild.org. Mock up the book’s working app with HTMLJavaScriptand CSSRebuild the sample appfirst with jQuery and then Ext JSWork with different build toolscode generatorsand package managersBuild a modularized version of the app with RequireJSApply test-driven development with the Jasmine frameworkUse WebSocket to build an online auction for the appAdapt the app for both PCs and mobile with responsive web designCreate mobile versions with jQuery MobileSencha Touchand PhoneGap
1077;3642327192;Organizations Environmental Performance Indicators: Measuring, Monitoring, and Management (Environmental Science and Engineering);http://ecx.images-amazon.com/images/I/51b3HzQvghL._SL160_.jpg;http://ecx.images-amazon.com/images/I/51b3HzQvghL._SL160_.jpg;FINISH;159.00;228;now();1011;1006;The book provides a collection of individual chapters from the participants in the OEPI projectwhich represent a mix of academic and practical chapters and contributions. The first part of the book is dedicated to a theoretical introduction to Organisations Environmental Performance Indicators and to a state-of-the-art overview in literature and practice. The second part of the book contains several chapters describing information systems and their components supporting the management of Environmental Performance Indicatorsespecially in inter-organizational contexts. The third part is dedicated to three case studies from practiceand the book concludes with part fourin which practical guidelines for the innovative management of Environmental Performance indicators in organizations and in inter-organizational contexts are presented
