id;isbn;title;small_image_url;medium_image_url;language;price;nb_of_pages;publication;category_id;publisher_id;description
1026;1430246923;Beginning Ejb 3: Java Ee 7 Edition (Beginning Apress) by Wetherbee, Jonathan, Rathod, Chirag, Kodali, Raghu (2013) Paperback;http://ecx.images-amazon.com/images/I/51LujmD8pXL._SL75_.jpg;http://ecx.images-amazon.com/images/I/51LujmD8pXL._SL160_.jpg;ENGLISH;49.99;452;now();1003;1010;Lorem ipsum dolor sit ametconsectetuer adipiscing elit. Aenean commodo ligula eget dolor. Aenean massa. Cum sociis natoque penatibus et magnis dis parturient montesnascetur ridiculus mus. Donec quam felisultricies necpellentesque eupretium quissem. Nulla consequat massa quis enim. Donec pede justofringilla velaliquet necvulputate egetarcu. In enim justorhoncus utimperdiet avenenatis vitaejusto. Nullam dictum felis eu pede mollis pretium. Integer tincidunt. Cras dapibus. Vivamus elementum semper nisi. Aenean vulputate eleifend tellus. Aenean leo ligulaporttitor euconsequat vitaeeleifend acenim. Aliquam lorem antedapibus inviverra quisfeugiat atellus. Phasellus viverra nulla ut metus varius laoreet. Quisque rutrum. Aenean imperdiet. Etiam ultricies nisi vel augue. Curabitur ullamcorper ultricies nisi. Nam eget dui. Etiam rhoncus. Maecenas tempustellus eget condimentum rhoncussem quam semper liberosit amet adipiscing sem neque sed ipsum. Nam quam nuncblandit velluctus pulvinarhendrerit idlorem. Maecenas nec odio et ante tincidunt tempus. Donec vitae sapien ut libero venenatis faucibus. Nullam quis ante. Etiam sit amet orci eget eros faucibus tincidunt. Duis leo. Sed fringilla mauris sit amet nibh. Donec sodales sagittis magna. Sed consequatleo eget bibendum sodalesaugue velit cursus nunc1004Lorem ipsum dolor sit ametconsectetuer adipiscing elit. Aenean commodo ligula eget dolor. Aenean massa. Cum sociis natoque penatibus et magnis dis parturient montesnascetur ridiculus mus. Donec quam felisultricies necpellentesque eupretium quissem. Nulla consequat massa quis enim. Donec pede justofringilla velaliquet necvulputate egetarcu. In enim justorhoncus utimperdiet avenenatis vitaejusto. Nullam dictum felis eu pede mollis pretium. Integer tincidunt. Cras dapibus. Vivamus elementum semper nisi. Aenean vulputate eleifend tellus. Aenean leo ligulaporttitor euconsequat vitaeeleifend acenim. Aliquam lorem antedapibus inviverra quisfeugiat atellus. Phasellus viverra nulla ut metus varius laoreet. Quisque rutrum. Aenean imperdiet. Etiam ultricies nisi vel augue. Curabitur ullamcorper ultricies nisi. Nam eget dui. Etiam rhoncus. Maecenas tempustellus eget condimentum rhoncussem quam semper liberosit amet adipiscing sem neque sed ipsum. Nam quam nuncblandit velluctus pulvinarhendrerit idlorem. Maecenas nec odio et ante tincidunt tempus. Donec vitae sapien ut libero venenatis faucibus. Nullam quis ante. Etiam sit amet orci eget eros faucibus tincidunt. Duis leo. Sed fringilla mauris sit amet nibh. Donec sodales sagittis magna. Sed consequatleo eget bibendum sodalesaugue velit cursus nunc
1027;1430239093;Beginning Java 7 (Experts Voice in Java);http://ecx.images-amazon.com/images/I/41imSrpwTsL._SL160_.jpg;http://ecx.images-amazon.com/images/I/41imSrpwTsL._SL160_.jpg;FINISH;44.99;920;now();1006;1007;Beginning Java 7 guides you through version 7 of the Java language and a wide assortment of platform APIs. New Java 7 language features that are discussed include switch-on-string and try-with-resources. APIs that are discussed include Threadingthe Collections Frameworkthe Concurrency UtilitiesSwingJava 2DnetworkingJDBCSAXDOMStAXXPathJAX-WSand SAAJ. This book also presents an introduction to Android app development so that you can apply some of its knowledge to the exciting world of Android app development. This book presents the following table of contents:Chapter 1 introduces you to Java and begins to cover the Java language by focusing on fundamental concepts such as commentsidentifiersvariablesexpressionsand statements. Chapter 2 continues to explore this language by presenting all of its features for working with classes and objects. You learn about features related to class declaration and object creationencapsulationinformation hidinginheritancepolymorphisminterfacesand garbage collection. Chapter 3 focuses on the more advanced language features related to nested classespackagesstatic importsexceptionsassertionsannotationsgenericsand enums. Additional chapters introduce you to the few features not covered in Chapters 1 through 3.Chapter 4 largely moves away from covering language features (although it does introduce class literals and strictfp) while focusing on language-oriented APIs. You learn about MathStrictMathPackagePrimitive Type Wrapper ClassesReferenceReflectionStringStringBuffer and StringBuilderThreadingBigDecimaland BigInteger in this chapter. Chapter 5 begins to explore Javas utility APIs by focusing largely on the Collections Framework. Howeverit also discusses legacy collection-oriented APIs and how to create your own collections. Chapter 6 continues to focus on utility APIs by presenting the concurrency utilities along with the Objects and Random classes. Chapter 7 moves you away from the command-line user interfaces that appear in previous chapters and toward graphical user interfaces. You first learn about the Abstract Window Toolkit foundationand then explore the Java Foundation Classes in terms of Swing and Java 2D. Appendix C explores Accessibility and Drag and Drop.Chapter 8 explores filesystem-oriented I/O in terms of the FileRandomAccessFilestreamand writer/reader classes. Chapter 9 introduces you to Javas network APIs (e.g.sockets). It also introduces you to the JDBC API for interacting with databases along with the Java DB database product. Chapter 10 dives into Javas XML support by first presenting an introduction to XML (including DTDs and schemas). It next explores the SAXDOMStAXXPathand XSLT APIs. It even briefly touches on the Validation API. While exploring XPathyou encounter namespace contextsextension functions and function resolversand variables and variable resolvers. Chapter 11 introduces you to Javas support for SOAP-based and RESTful web services. As well as providing you with the basics of these web service categoriesChapter 11 presents some advanced topicssuch as working with the SAAJ API to communicate with a SOAP-based web service without having to rely on JAX-WS. You will appreciate having learned about XML in Chapter 10 before diving into this chapter. Chapter 12 helps you put to use some of the knowledge youve gathered in previous chapters by showing you how to use Java to write an Android apps source code. This chapter introduces you to Androiddiscusses its architectureshows you how to install necessary toolsand develops a simple app. Appendix A presents the solutions to the programming exercises that appear near the end of Chapters 1 through 12. Appendix B introduces you to Javas Scripting API along with Java 7s support for dynamically typed languages. Appendix C introduces you to additional APIs and architecture topics. Examples include AccessibilityclassloadersConsoleDrag and DropJava Native Interfaceand System Tray. Appendix D presents a gallery of significant applications that demonstrate various aspects of Java. Unfortunatelythere are limits to how much knowledge can be crammed into a print book. For this reasonAppendixes ABCand D are not included in this books pages. Insteadthese appendixes are freely distributed as PDF files. Appendixes A and B are bundled with the books associated code file at the Apress website (http://www.apress.com/9781430239093). Appendixes C and D are bundled with their respective code files at my TutorTutor.ca website (http://tutortutor.ca/cgi-bin/makepage.cgi?/books/bj7).What you’ll learnThe entire Java languageincluding Java 7-specific features such as switch on stringtry-with-resourcesfinal rethrowmulticatchand SafeVarargs A huge assortment of Java 7 APIsbeginning with those APIs oriented toward the language itselfand including Java 7-specific APIs such as the Fork/Join FrameworkObjectsand JLayer Various Java 7 toolsstarting with the javac compiler and java application launcherHow to create user interfacesworking with web servicesand a whole lot moreThe basics of getting started with Android app developmentWho this book is forThis book targets the following groups of developers:Newcomersskilled (to some degree) in other programming languages but with no previous exposure to Java Intermediate Java developersskilled in the fundamentals of Java prior to Java 7 and looking to increase their understanding of Java 7 language/API changes All developers looking beyond standard Javawho want to leverage Java 7 to create mobile apps via Android Even advanced Java developers may find a few items of interest.Table of ContentsGetting Started with JavaDiscovering Classes and ObjectsExploring Advanced Language FeaturesTouring Language and Utility APIsCollecting ObjectsTouring Additional Utility APIsCreating and Enriching Graphical User InterfacesInteracting with FilesystemsInteracting with Networks and DatabasesParsingCreatingand Transforming XML DocumentsWorking with Web ServicesJava 7 Meets Android
1028;1590594703;Beginning Java EE 5: From Novice to Professional;http://ecx.images-amazon.com/images/I/51hED8w6dIL._SL160_.jpg;http://ecx.images-amazon.com/images/I/51hED8w6dIL._SL160_.jpg;ENGLISH;49.99;672;now();1005;1006;Sun’s new lightweight Java Enterprise Edition (EE) 5 is an extremely powerful platform for developing enterprise-level Java-based applicationsprimarily for the server. This book shows you how to harness that powerexamining how the pieces of the new Java EE 5 platform fit togetherincluding the redesigned annotations-driven EJB 3 spec as well as JavaServer Faces (JSF)integrated into the platform for the first time. Hands-on tutorials are also includedalong with clear explanations and working code examples. You will grow to take the next step—from writing client-side desktop applications to writing enterprise applications. You will also learn how to use the individual APIs and tools in the Java EE 5 platformand how to merge these to create your own enterprise applications
1029;1430219548;Beginning Java EE 6 Platform with GlassFish 3: From Novice to Professional (Experts Voice in Java Technology);http://ecx.images-amazon.com/images/I/51RDbgIIVeL._SL160_.jpg;http://ecx.images-amazon.com/images/I/51RDbgIIVeL._SL160_.jpg;FRENCH;44.99;500;now();1000;1000;Java Enterprise Edition (Java EE) continues to be one of the leading Java technologies and platforms from Oracle (previously Sun). Beginning Java EE 6 Platform with GlassFish 3Second Edition is this first tutorial book on the final (RTM) version of the Java EE 6 Platform. Step by step and easy to followthis book describes many of the Java EE 6 specifications and reference implementationsand shows them in action using practical examples. This book uses the new version of GlassFish 3 to deploy and administer the code examples. Written by an expert member of the Java EE 6 specification request and review board in the Java Community Process (JCP)this book contains the best information possiblefrom an expert’s perspective on enterprise Java technologies. What you’ll learnGet started with the final version of the Java EE 6 Platform.Explore and use the new EJB 3.1 and JPA 2.0 APIs from entities to session beans to message-driven beansand more. Discover the web tier development APIs including JSPsJSTLand Expression Languageand especially JSF 2.0 and Facelets. Uncover the new web servicesRESTful servicesand more available in Java EE 6.Create dynamic user interfaces for your enterprise and transactional Java applications.Who this book is forThis book is for advanced Java programmers as well as Java EE 6 beginners. Architects will also find information about how to layer their Java EE applications. Table of ContentsJava EE 6 at a GlanceJava PersistenceObject-Relational MappingManaging Persistent ObjectsCallbacks and ListenersEnterprise Java BeansSession Beans and the Timer ServiceCallbacks and InterceptorsTransactions and SecurityJavaServer FacesPages and ComponentsProcessing and NavigationSending MessagesSOAP Web ServicesRESTful Web Services
1030;143022889X;Beginning Java EE 6 with GlassFish 3 (Experts Voice in Java Technology);http://ecx.images-amazon.com/images/I/51baRLwlufL._SL160_.jpg;http://ecx.images-amazon.com/images/I/51baRLwlufL._SL160_.jpg;GERMAN;49.99;536;now();1008;1005;Java Enterprise Edition (Java EE) continues to be one of the leading Java technologies and platforms from Oracle (previously Sun). Beginning Java EE 6 Platform with GlassFish 3Second Edition is this first tutorial book on the final version of the Java EE 6 Platform. Step by step and easy to followthis book describes many of the Java EE 6 specifications and reference implementationsand shows them in action using practical examples. This book uses the new version of GlassFish 3 to deploy and administer the code examples. Written by an expert member of the Java EE 6 specification request and review board in the Java Community Process (JCP)this book contains the best information possiblefrom an expert’s perspective on enterprise Java technologies. What you’ll learnGet started with the final version of the Java EE 6 Platform.Explore and use the EJB 3.1 and JPA 2.0 APIs from entities to session beans to message driven beansand more. Discover web tier development APIs including JSPsJSTLand Expression Languageand especially the new JSF 2.0 and Facelets. Uncover the web servicesRESTful servicesand more available in Java EE 6.Create dynamic user interfaces for your enterprise and transactional Java applications.Who this book is forThis book is for advanced Java programmers as well as Java EE 6 beginners. Architects will also find information about how to layer their Java EE applications. Table of ContentsJava EE 6 at a GlanceJava PersistenceObject-Relational MappingManaging Persistent ObjectsCallbacks and ListenersEnterprise Java BeansSession Beans and the Timer ServiceCallbacks and InterceptorsTransactions and SecurityJavaServer FacesPages and ComponentsProcessing and NavigationSending MessagesSOAP Web ServicesRESTful Web Services
1031;8132214080;Beginning Java EE 7;http://ecx.images-amazon.com/images/I/51-RiUoDB-L._SL75_.jpg;http://ecx.images-amazon.com/images/I/51-RiUoDB-L._SL160_.jpg;GERMAN;49.99;536;now();1002;1008;Java enterprise edition (java ee) continues to be one of the leading java technologies and platforms. Beginning java ee 7 is the first tutorial book on java ee 7. Step by step and easy to followthis book describes many of the java ee 7 specifications and reference implementations and shows them in action using practical examples. This definitive book also uses the newest version of glassfish to deploy and administer the code examples. Java ee 7 environment context and dependency injection bean validation java persistence api object-relational mapping managing persistent object enterprise java beans callbackstimer service and authorization interceptors and transactions javaserver faces processing and navigation xml and json messaging soap web services restful web service table of contents: introduction to the ejb 3 architecture session beans entities and the java persistence api advanced persistence features message-driven beans ejb and web services integrating session beansentitiesmessage-driven beans and web services transaction management ejb performance and testing context and dependency injection (cdi) packaging and deployment ejb client applications ejb runtime environments
1032;8132214081;Beginning Java EE 7 (Expert Voice in Java) 1st (first) by Goncalves, Antonio (2013) Paperback;http://ecx.images-amazon.com/images/I/51amFVZbyKL._SL75_.jpg;http://ecx.images-amazon.com/images/I/51amFVZbyKL._SL160_.jpg;SPANISH;49.99;536;now();1002;1008;Java enterprise edition (java ee) continues to be one of the leading java technologies and platforms. Beginning java ee 7 is the first tutorial book on java ee 7. Step by step and easy to followthis book describes many of the java ee 7 specifications and reference implementations and shows them in action using practical examples. This definitive book also uses the newest version of glassfish to deploy and administer the code examples. Java ee 7 environment context and dependency injection bean validation java persistence api object-relational mapping managing persistent object enterprise java beans callbackstimer service and authorization interceptors and transactions javaserver faces processing and navigation xml and json messaging soap web services restful web service table of contents: introduction to the ejb 3 architecture session beans entities and the java persistence api advanced persistence features message-driven beans ejb and web services integrating session beansentitiesmessage-driven beans and web services transaction management ejb performance and testing context and dependency injection (cdi) packaging and deployment ejb client applications ejb runtime environments1002Lorem ipsum dolor sit ametconsectetuer adipiscing elit. Aenean commodo ligula eget dolor. Aenean massa. Cum sociis natoque penatibus et magnis dis parturient montesnascetur ridiculus mus. Donec quam felisultricies necpellentesque eupretium quissem. Nulla consequat massa quis enim. Donec pede justofringilla velaliquet necvulputate egetarcu. In enim justorhoncus utimperdiet avenenatis vitaejusto. Nullam dictum felis eu pede mollis pretium. Integer tincidunt. Cras dapibus. Vivamus elementum semper nisi. Aenean vulputate eleifend tellus. Aenean leo ligulaporttitor euconsequat vitaeeleifend acenim. Aliquam lorem antedapibus inviverra quisfeugiat atellus. Phasellus viverra nulla ut metus varius laoreet. Quisque rutrum. Aenean imperdiet. Etiam ultricies nisi vel augue. Curabitur ullamcorper ultricies nisi. Nam eget dui. Etiam rhoncus. Maecenas tempustellus eget condimentum rhoncussem quam semper liberosit amet adipiscing sem neque sed ipsum. Nam quam nuncblandit velluctus pulvinarhendrerit idlorem. Maecenas nec odio et ante tincidunt tempus. Donec vitae sapien ut libero venenatis faucibus. Nullam quis ante. Etiam sit amet orci eget eros faucibus tincidunt. Duis leo. Sed fringilla mauris sit amet nibh. Donec sodales sagittis magna. Sed consequatleo eget bibendum sodalesaugue velit cursus nunc
1033;8132214082;Beginning Java EE 7 (Expert Voice in Java) 1st edition by Goncalves, Antonio (2013) Paperback;http://ecx.images-amazon.com/images/I/51amFVZbyKL._SL75_.jpg;http://ecx.images-amazon.com/images/I/51amFVZbyKL._SL160_.jpg;FRENCH;49.99;536;now();1010;1003;Lorem ipsum dolor sit ametconsectetuer adipiscing elit. Aenean commodo ligula eget dolor. Aenean massa. Cum sociis natoque penatibus et magnis dis parturient montesnascetur ridiculus mus. Donec quam felisultricies necpellentesque eupretium quissem. Nulla consequat massa quis enim. Donec pede justofringilla velaliquet necvulputate egetarcu. In enim justorhoncus utimperdiet avenenatis vitaejusto. Nullam dictum felis eu pede mollis pretium. Integer tincidunt. Cras dapibus. Vivamus elementum semper nisi. Aenean vulputate eleifend tellus. Aenean leo ligulaporttitor euconsequat vitaeeleifend acenim. Aliquam lorem antedapibus inviverra quisfeugiat atellus. Phasellus viverra nulla ut metus varius laoreet. Quisque rutrum. Aenean imperdiet. Etiam ultricies nisi vel augue. Curabitur ullamcorper ultricies nisi. Nam eget dui. Etiam rhoncus. Maecenas tempustellus eget condimentum rhoncussem quam semper liberosit amet adipiscing sem neque sed ipsum. Nam quam nuncblandit velluctus pulvinarhendrerit idlorem. Maecenas nec odio et ante tincidunt tempus. Donec vitae sapien ut libero venenatis faucibus. Nullam quis ante. Etiam sit amet orci eget eros faucibus tincidunt. Duis leo. Sed fringilla mauris sit amet nibh. Donec sodales sagittis magna. Sed consequatleo eget bibendum sodalesaugue velit cursus nunc
1034;8132214083;Beginning Java Ee 7 (Expert Voice in Java) by Goncalves, Antonio (2013) Paperback;http://ecx.images-amazon.com/images/I/51amFVZbyKL._SL75_.jpg;http://ecx.images-amazon.com/images/I/51amFVZbyKL._SL160_.jpg;SPANISH;49.99;536;now();1010;1003;Lorem ipsum dolor sit ametconsectetuer adipiscing elit. Aenean commodo ligula eget dolor. Aenean massa. Cum sociis natoque penatibus et magnis dis parturient montesnascetur ridiculus mus. Donec quam felisultricies necpellentesque eupretium quissem. Nulla consequat massa quis enim. Donec pede justofringilla velaliquet necvulputate egetarcu. In enim justorhoncus utimperdiet avenenatis vitaejusto. Nullam dictum felis eu pede mollis pretium. Integer tincidunt. Cras dapibus. Vivamus elementum semper nisi. Aenean vulputate eleifend tellus. Aenean leo ligulaporttitor euconsequat vitaeeleifend acenim. Aliquam lorem antedapibus inviverra quisfeugiat atellus. Phasellus viverra nulla ut metus varius laoreet. Quisque rutrum. Aenean imperdiet. Etiam ultricies nisi vel augue. Curabitur ullamcorper ultricies nisi. Nam eget dui. Etiam rhoncus. Maecenas tempustellus eget condimentum rhoncussem quam semper liberosit amet adipiscing sem neque sed ipsum. Nam quam nuncblandit velluctus pulvinarhendrerit idlorem. Maecenas nec odio et ante tincidunt tempus. Donec vitae sapien ut libero venenatis faucibus. Nullam quis ante. Etiam sit amet orci eget eros faucibus tincidunt. Duis leo. Sed fringilla mauris sit amet nibh. Donec sodales sagittis magna. Sed consequatleo eget bibendum sodalesaugue velit cursus nunc1005Lorem ipsum dolor sit ametconsectetuer adipiscing elit. Aenean commodo ligula eget dolor. Aenean massa. Cum sociis natoque penatibus et magnis dis parturient montesnascetur ridiculus mus. Donec quam felisultricies necpellentesque eupretium quissem. Nulla consequat massa quis enim. Donec pede justofringilla velaliquet necvulputate egetarcu. In enim justorhoncus utimperdiet avenenatis vitaejusto. Nullam dictum felis eu pede mollis pretium. Integer tincidunt. Cras dapibus. Vivamus elementum semper nisi. Aenean vulputate eleifend tellus. Aenean leo ligulaporttitor euconsequat vitaeeleifend acenim. Aliquam lorem antedapibus inviverra quisfeugiat atellus. Phasellus viverra nulla ut metus varius laoreet. Quisque rutrum. Aenean imperdiet. Etiam ultricies nisi vel augue. Curabitur ullamcorper ultricies nisi. Nam eget dui. Etiam rhoncus. Maecenas tempustellus eget condimentum rhoncussem quam semper liberosit amet adipiscing sem neque sed ipsum. Nam quam nuncblandit velluctus pulvinarhendrerit idlorem. Maecenas nec odio et ante tincidunt tempus. Donec vitae sapien ut libero venenatis faucibus. Nullam quis ante. Etiam sit amet orci eget eros faucibus tincidunt. Duis leo. Sed fringilla mauris sit amet nibh. Donec sodales sagittis magna. Sed consequatleo eget bibendum sodalesaugue velit cursus nunc
1035;8132214084;[(Beginning Java EE 7 )] [Author: Antonio Goncalves] [Jul-2013];http://ecx.images-amazon.com/images/I/41UVAFtzrWL._SL75_.jpg;http://ecx.images-amazon.com/images/I/41UVAFtzrWL._SL160_.jpg;PORTUGUESE;49.99;536;now();1011;1005;Lorem ipsum dolor sit ametconsectetuer adipiscing elit. Aenean commodo ligula eget dolor. Aenean massa. Cum sociis natoque penatibus et magnis dis parturient montesnascetur ridiculus mus. Donec quam felisultricies necpellentesque eupretium quissem. Nulla consequat massa quis enim. Donec pede justofringilla velaliquet necvulputate egetarcu. In enim justorhoncus utimperdiet avenenatis vitaejusto. Nullam dictum felis eu pede mollis pretium. Integer tincidunt. Cras dapibus. Vivamus elementum semper nisi. Aenean vulputate eleifend tellus. Aenean leo ligulaporttitor euconsequat vitaeeleifend acenim. Aliquam lorem antedapibus inviverra quisfeugiat atellus. Phasellus viverra nulla ut metus varius laoreet. Quisque rutrum. Aenean imperdiet. Etiam ultricies nisi vel augue. Curabitur ullamcorper ultricies nisi. Nam eget dui. Etiam rhoncus. Maecenas tempustellus eget condimentum rhoncussem quam semper liberosit amet adipiscing sem neque sed ipsum. Nam quam nuncblandit velluctus pulvinarhendrerit idlorem. Maecenas nec odio et ante tincidunt tempus. Donec vitae sapien ut libero venenatis faucibus. Nullam quis ante. Etiam sit amet orci eget eros faucibus tincidunt. Duis leo. Sed fringilla mauris sit amet nibh. Donec sodales sagittis magna. Sed consequatleo eget bibendum sodalesaugue velit cursus nunc
